document_category,decision_id,title,decision_date,cluster,color,x,y,amount,case_type
complaint_or_interpretation,1001,"건강보험증 송달 관련 민원처리의 건1. 주 문민원인 정OO(울산광역시 북구 거주)이 국민건강보험공단의 건강보험증 송달과 관련하여 제기한 민원에 대하여 다음과 같이 민원인에게 통지한다.“건강보험증은 우편봉투에 봉함되어 송달되고, 「우편법」에 따라 무단개",2014-06-09,5,#b45309,81.08815002441406,60.542991638183594,,유출·침해;동의·고지 위반;정보주체 권리보장
complaint_or_interpretation,1005,「개인정보 보호법」 제6조 및 제18조 관련 해석의 건 (개인정보보호위원회 심의ㆍ의결 통보사항에 대한 안전행정부의 추가질의 관련 법령해석의 건),2014-05-12,-1,#8a8a8a,78.64226531982422,20.175155639648438,,동의·고지 위반;목적 외 이용;민감정보·고유식별정보;정보주체 권리보장
complaint_or_interpretation,1039,"충주시 교통, 방범 영상의 경찰서, 소방서, 군부대 제공 관련 질의 건",2015-11-23,1,#059669,23.312694549560547,94.0,,유출·침해;동의·고지 위반;영상정보 처리
complaint_or_interpretation,1045,육군 제6755부대의 대구ㆍ경북지역 통합관제센터 및 경찰 상황실 영상정보 제공에 대한 질의 건,2015-11-09,2,#dc2626,24.45195960998535,69.781494140625,,영상정보 처리;정보주체 권리보장
complaint_or_interpretation,1059,경찰청의 거래대상 휴대폰/계좌번호 인터넷사기 피해신고 여부 확인 서비스 제공 관련 질의 건,2015-10-26,5,#b45309,68.56349182128906,62.22238540649414,,유출·침해;목적 외 이용;처리위탁
complaint_or_interpretation,1083,시각장애인 운전면허 적성검사결과 제공 관련 추가 질의 건,2016-06-27,5,#b45309,72.72992706298828,56.7454948425293,,유출·침해;목적 외 이용
complaint_or_interpretation,1087,쓰레기 무단투기 영상제공 관련 질의 건,2016-01-11,-1,#8a8a8a,28.130741119384766,55.818782806396484,,유출·침해;영상정보 처리
complaint_or_interpretation,1091,인천광역시 소방본부의 인천광역시 관내 영상 관련 질의 건,2015-12-28,1,#059669,12.326845169067383,88.05720520019531,,유출·침해;동의·고지 위반;영상정보 처리
complaint_or_interpretation,1093,지방공무원 배우자의 개인정보 처리 질의 건,2016-06-13,5,#b45309,85.60649108886719,66.08030700683594,,유출·침해;목적 외 이용
complaint_or_interpretation,1095,충청남도의 도청 소속 공무원 인사이력 도의회 제출 관련 질의 건,2016-04-11,0,#1e40af,84.96855926513672,88.21939086914062,,유출·침해;목적 외 이용
complaint_or_interpretation,1097,대구광역시 북구청 영상정보 제공 관련 질의 건,2016-01-25,2,#dc2626,10.815895080566406,65.73138427734375,,유출·침해;동의·고지 위반;안전조치 미흡;영상정보 처리
complaint_or_interpretation,1099,한국수력원자력주식회사의 자체감사를 위한 개인정보 이용ㆍ제공 관련 질의 건,2016-07-11,-1,#8a8a8a,88.60318756103516,33.46171188354492,,유출·침해;동의·고지 위반;목적 외 이용;제3자 제공;정보주체 권리보장
complaint_or_interpretation,1101,고양시의 영상정보제공 관련 질의 건,2016-09-12,2,#dc2626,34.03148651123047,69.28842163085938,,안전조치 미흡;영상정보 처리;접근권한·내부통제
complaint_or_interpretation,1103,피내사자의 개인정보 제공 관련 질의 건,2016-05-09,0,#1e40af,94.0,77.40037536621094,,유출·침해;목적 외 이용;제3자 제공
complaint_or_interpretation,1107,한국고용정보원의 연구목적을 위한 개인정보 처리 질의 건,2016-09-26,-1,#8a8a8a,83.11643981933594,33.57843780517578,,처리위탁;정보주체 권리보장
complaint_or_interpretation,1109,대구광역시 남구청 영상정보 제공 관련 질의 건,2016-01-25,2,#dc2626,11.059236526489258,76.21825408935547,,유출·침해;동의·고지 위반;안전조치 미흡;영상정보 처리
complaint_or_interpretation,1113,교통영상정보 외부기관 연계ㆍ송출의 개인정보보호법 저촉 여부 질의 건,2012-12-24,2,#dc2626,36.993370056152344,72.93399047851562,,유출·침해;영상정보 처리
complaint_or_interpretation,1115,국가공무원 배우자의 개인정보 처리 질의 건,2016-10-10,5,#b45309,93.47720336914062,58.161930084228516,,유출·침해;목적 외 이용
complaint_or_interpretation,1117,부산광역시 건설안전시험사업소의 과적차량 단속정보 관련 질의 건,2016-11-14,0,#1e40af,54.821678161621094,68.2354736328125,,민감정보·고유식별정보
complaint_or_interpretation,1121,지방공기업 임직원의 개인정보 제공 질의 건,2016-10-10,0,#1e40af,89.4740219116211,82.86551666259766,,유출·침해;목적 외 이용
complaint_or_interpretation,1131,쓰레기 무단투기 단속을 위한 영상 수집ㆍ이용 관련 질의 건,2016-11-14,-1,#8a8a8a,43.76216506958008,57.619503021240234,,영상정보 처리
complaint_or_interpretation,1133,서울특별시지방경찰청의 범칙금 납부 여부 관련 질의에 관한 건,2017-02-13,0,#1e40af,64.07621765136719,77.14816284179688,,
complaint_or_interpretation,1143,의무교육대상자 취학독려를 위한 개인정보 이용ㆍ제공 가능여부 질의의 건,2014-09-15,5,#b45309,89.05288696289062,49.4249382019043,,동의·고지 위반
complaint_or_interpretation,1317,한국도로공사의 터널 내 영상정보처리기기 설치ㆍ운영 관련 법령해석에 관한 건,2019-12-09,3,#7c3aed,47.59850311279297,19.71813201904297,,영상정보 처리
complaint_or_interpretation,1331,한국도로공사의 적재중량 초과 차량정보 처리 관련 법령해석에 관한 건,2020-02-10,-1,#8a8a8a,56.5157470703125,27.535390853881836,,유출·침해;영상정보 처리;정보주체 권리보장
complaint_or_interpretation,1333,국회 인사청문회를 위한 개인정보 제공 관련 법령해석에 관한 건,2020-02-24,-1,#8a8a8a,93.7713623046875,38.63247299194336,,유출·침해;동의·고지 위반;목적 외 이용;민감정보·고유식별정보;정보주체 권리보장
complaint_or_interpretation,1341,성동구의 개인영상정보 열람요구 관련 법령해석에 관한 건,2020-06-08,-1,#8a8a8a,14.803352355957031,45.05064392089844,,유출·침해;동의·고지 위반;목적 외 이용;영상정보 처리;정보주체 권리보장
complaint_or_interpretation,1377,한국도로공사 전북본부의 좌석안전띠 착용 검지 목적의 영상정보처리기기 설치에 대한 법령해석에 관한 건,2019-06-10,3,#7c3aed,43.989139556884766,12.293130874633789,,영상정보 처리
complaint_or_interpretation,1389,은평구의 개인영상정보 열람요구 거절 관련 법령해석에 관한 건,2019-07-22,-1,#8a8a8a,22.73829460144043,37.42817687988281,,유출·침해;영상정보 처리;정보주체 권리보장
complaint_or_interpretation,1391,부산광역시의 영상정보처리기기 설치 목적 추가를 위한 법령해석에 관한 건,2019-06-24,3,#7c3aed,38.05757141113281,28.052139282226562,,영상정보 처리
complaint_or_interpretation,1399,광주광역시 동구의 주ㆍ정차 관련 민원업무를 위한 개인정보 이용에 관한 건,2019-09-09,4,#0d9488,60.28742980957031,51.32521438598633,,유출·침해;목적 외 이용
complaint_or_interpretation,1407,경찰관의 개인정보 사적 이용행위 관련 법령해석에 관한 건,2019-11-11,4,#0d9488,70.2900390625,45.1922607421875,,유출·침해;동의·고지 위반;목적 외 이용;처리위탁
complaint_or_interpretation,1415,자동차등록번호 제공 관련 법령해석에 관한 건,2019-09-23,4,#0d9488,64.21624755859375,45.23552703857422,,동의·고지 위반;제3자 제공;민감정보·고유식별정보
complaint_or_interpretation,1435,평택시의 「찾아가는 생활민원SOS 서비스」 안내를 위한 개인정보 이용에 관한 건,2019-05-27,0,#1e40af,78.14603424072266,80.48777770996094,,유출·침해;목적 외 이용
complaint_or_interpretation,157,의정부시의 영상정보처리기기 설치목적 추가를 위한 법령해석에 관한 건,2018-12-24,3,#7c3aed,34.471038818359375,16.036834716796875,,영상정보 처리
complaint_or_interpretation,171,경찰청의 웨어러블 카메라 사용의 개인정보보호법령상 가능여부 질의 건,2015-06-08,-1,#8a8a8a,35.15990447998047,46.4010009765625,,영상정보 처리
complaint_or_interpretation,177,서울특별시의 소송비용 회수를 위한 개인정보 이용 관련 질의 건,2015-02-23,0,#1e40af,67.93484497070312,89.98272705078125,,목적 외 이용;민감정보·고유식별정보;정보주체 권리보장
complaint_or_interpretation,189,안양시 교통ㆍ방범 영상정보의 경찰서ㆍ소방서ㆍ군부대 제공 관련 질의 건,2015-06-08,1,#059669,29.187400817871094,88.07298278808594,,유출·침해;동의·고지 위반;영상정보 처리;정보주체 권리보장
complaint_or_interpretation,197,청주시 영상정보의 방송ㆍ신문사 제공 관련 질의 건,2015-06-22,1,#059669,14.515872955322266,92.30210876464844,,유출·침해;동의·고지 위반;목적 외 이용;영상정보 처리;정보주체 권리보장
complaint_or_interpretation,203,경찰청의 인사 관련 개인정보 처리에 관한 질의 건,2015-06-08,0,#1e40af,74.00458526611328,76.0241470336914,,동의·고지 위반;민감정보·고유식별정보
complaint_or_interpretation,205,포항시 통합관제센터 영상정보의 해병대 제1사단 제공 관련 질의 건,2015-04-13,2,#dc2626,24.422842025756836,76.31675720214844,,영상정보 처리;정보주체 권리보장
complaint_or_interpretation,221,고용노동부 청년구직활동지원금 사업을 위한 주민등록번호 처리 관련 법령해석에 관한 건,2019-05-13,0,#1e40af,73.2307357788086,78.99847412109375,,민감정보·고유식별정보
complaint_or_interpretation,227,동두천시의 영상정보처리기기 설치목적 추가를 위한 법령해석에 관한 건,2019-03-25,3,#7c3aed,39.133026123046875,8.257299423217773,,영상정보 처리
complaint_or_interpretation,321,종로구 영상정보의 국회 제공 관련 질의 건,2015-07-13,2,#dc2626,6.0,76.98478698730469,,유출·침해;목적 외 이용;영상정보 처리
complaint_or_interpretation,329,상주시 굴착공사 장소에 관한 정보의 주식회사 영남에너지서비스 제공 관련질의 건,2015-08-24,0,#1e40af,52.790489196777344,79.80509185791016,,민감정보·고유식별정보
complaint_or_interpretation,337,시각장애인 운전면허 적성검사결과 제공 관련 질의 건,2015-10-12,4,#0d9488,76.36284637451172,46.023887634277344,,유출·침해;목적 외 이용;민감정보·고유식별정보;처리위탁
complaint_or_interpretation,341,포항시 교통영상정보의 도로교통공단 제공 관련 질의 건,2015-08-24,1,#059669,40.0271110534668,85.84175109863281,,유출·침해;영상정보 처리
complaint_or_interpretation,343,국토교통부ㆍ한국도로공사 교통사고 영상정보의 손해보험사 제공 관련 질의 건,2015-09-14,-1,#8a8a8a,61.675941467285156,33.93964767456055,,유출·침해;동의·고지 위반;목적 외 이용;영상정보 처리;처리위탁
complaint_or_interpretation,371,개인정보보호 관련 법령해석 요청 건,2013-10-28,-1,#8a8a8a,74.83906555175781,16.70423126220703,,목적 외 이용;제3자 제공
complaint_or_interpretation,377,폐업 국제결혼중개업소 이용자 신상정보 보존 관련 질의 건,2014-01-13,5,#b45309,89.62202453613281,63.391510009765625,,보유기간·파기 위반
complaint_or_interpretation,421,CCTV를 이용한 동의 없는 개인정보 수집처리에 관한 법령해석,2013-05-27,-1,#8a8a8a,42.91039276123047,42.98271942138672,,동의·고지 위반;목적 외 이용;영상정보 처리
complaint_or_interpretation,495,남산도서관의 체온 카메라 및 신분증 자동 인식기 설치ㆍ운영에 대한 법령해석에 관한 건,2021-01-27,3,#7c3aed,29.13193130493164,6.958214282989502,,동의·고지 위반
complaint_or_interpretation,523,부산광역시경찰청의 이동형 IP카메라 사용을 위한 법령해석에 관한 건,2021-05-26,3,#7c3aed,32.844886779785156,24.614715576171875,,영상정보 처리
complaint_or_interpretation,561,법원의 사실조회 신청에 따른 시ㆍ군ㆍ구의 출입국 사실증명 발급 관련 법령해석에 관한 건,2021-10-13,-1,#8a8a8a,21.455486297607422,21.265884399414062,,
complaint_or_interpretation,685,서울본부세관의 마약 범죄 수사를 위한 IP카메라 설치ㆍ운영 관련 법령해석 건,2022-03-23,3,#7c3aed,31.145755767822266,6.0,,유출·침해;보유기간·파기 위반
complaint_or_interpretation,947,한국교통안전공단의 운행기록데이터 등 제공 관련 법령해석에 관한 건,2020-01-13,-1,#8a8a8a,69.36239624023438,24.33031463623047,,유출·침해;목적 외 이용;제3자 제공;안전조치 미흡;민감정보·고유식별정보;처리위탁
complaint_or_interpretation,957,관악구 CCTV 영상정보 제공 관련 법령해석 요청 건,2012-11-12,2,#dc2626,16.496688842773438,63.41041946411133,,목적 외 이용;제3자 제공;영상정보 처리
complaint_or_interpretation,985,육군 제7516부대의 경주시 통합관제센터 영상정보 제공에 대한 질의 건,2016-03-14,2,#dc2626,20.01724624633789,77.79755401611328,,영상정보 처리;정보주체 권리보장
data_provision_request,10011,관세청의 통관 업무 수행을 위한 출입국ㆍ외국인청 보유 개인정보 제공 요청에 관한 건,2025-07-09,0,#1e40af,78.5739517211914,22.456735610961914,,목적 외 이용
data_provision_request,1003,부산해양경찰서의 업무 수행을 위한 남항관리사업소 보유 CCTV 영상정보 제공 요청에 관한 건,2020-10-14,-1,#8a8a8a,40.65291213989258,21.449901580810547,,영상정보 처리
data_provision_request,10123,소방서의 화재안전취약자 지원 사업을 위한 시ㆍ군ㆍ구 보유 개인정보 제공 요청에 관한 건,2025-09-24,2,#dc2626,62.986995697021484,44.608543395996094,,목적 외 이용
data_provision_request,10183,질병관리청의 예방접종 피해 중복보상 방지를 위한 근로복지공단ㆍ공무원연금공단ㆍ사학연금공단ㆍ국방부 보유 개인정보 제공 요청에 관한 건,2025-10-22,2,#dc2626,84.6509780883789,56.349422454833984,,목적 외 이용
data_provision_request,10185,기후에너지환경부의 에너지바우처 발급 대상자 발굴 및 신청 안내를 위한 보건복지부 보유 개인정보 제공 요청에 관한 건,2025-11-20,2,#dc2626,80.62785339355469,44.569522857666016,,목적 외 이용
data_provision_request,10283,한국교통안전공단의 자동차사고 조사를 위한 소방청 보유 개인정보 제공 요청에 관한 건,2025-12-10,3,#7c3aed,61.951698303222656,12.478048324584961,,목적 외 이용
data_provision_request,1035,국가배상금을 지급받은 보훈급여금 수령자의 개인정보 제공에 관한 건,2017-11-13,4,#0d9488,18.06381607055664,82.4760513305664,,목적 외 이용
data_provision_request,10405,소방서의 소방시설관리업자에 대한 감독 업무를 위한 관계인 보유 영상정보 제공 요청에 관한 건,2026-03-11,-1,#8a8a8a,42.28611755371094,25.637117385864258,,영상정보 처리
data_provision_request,10419,파주시의 생활안정지원금 지급 업무를 위한 법무부 보유 개인정보 제공 요청에 관한 건,2026-03-25,0,#1e40af,91.1255874633789,27.057138442993164,,목적 외 이용
data_provision_request,1043,교통량 분석 통계작성을 위한 개인정보 제공에 관한 건,2017-12-11,1,#059669,19.050800323486328,41.27103805541992,,영상정보 처리
data_provision_request,1047,기초생활보장 신규 수급권자 발굴 및 안내를 위한 개인정보 제공에 관한 건,2018-03-26,5,#b45309,22.176591873168945,67.16026306152344,,목적 외 이용
data_provision_request,1049,과세특례제도 운영을 위한 해외이주 신고자 개인정보 제공에 관한 건,2017-12-11,4,#0d9488,6.0,76.4218978881836,,목적 외 이용
data_provision_request,1053,주택용 소방시설 무상 지원ㆍ보급을 위한 개인정보 제공에 관한 건,2018-01-08,-1,#8a8a8a,40.167747497558594,51.74911880493164,,목적 외 이용
data_provision_request,1055,예금보험기금 회수를 위한 국민연금 가입자 개인정보 제공에 관한 건,2018-05-14,4,#0d9488,27.652942657470703,78.15254211425781,,목적 외 이용
data_provision_request,1071,행정안전부의 장애인 관련 통계작성을 위한 개인정보 제공에 관한 건,2017-11-27,5,#b45309,23.564847946166992,64.92277526855469,,목적 외 이용
data_provision_request,1073,운전면허 수시 적성검사를 위한 치매질환자 개인정보 제공에 관한 건,2017-07-24,1,#059669,15.816583633422852,43.09452438354492,,목적 외 이용
data_provision_request,111,병무청의 병역의무자 병적관리를 위한 법무부 보유 개인정보 제공에 관한 건,2018-10-29,4,#0d9488,9.883946418762207,85.51611328125,,목적 외 이용
data_provision_request,1135,국제표준이름식별기호(ISNI) 관련 국립중앙도서관의 개인정보 제공에 관한 건,2017-01-23,5,#b45309,15.146946907043457,67.48237609863281,,목적 외 이용
data_provision_request,1139,외국인 중도입국자녀 공교육 진입 지원을 위한 개인정보 제공에 관한 건,2017-01-09,4,#0d9488,8.2792329788208,76.71636962890625,,목적 외 이용
data_provision_request,115,독거인 모니터링 시스템 구축을 위한 한국전력공사 보유 개인정보 제공 요청에 관한 건,2018-08-27,-1,#8a8a8a,42.48051452636719,52.0500373840332,,목적 외 이용
data_provision_request,1233,근로복지공단의 긴급재난기부금 모집 관련 업무를 위한 행정안전부 보유 개인정보 제공 요청에 관한 건,2020-07-13,5,#b45309,25.905426025390625,69.4788818359375,,목적 외 이용
data_provision_request,1237,경상북도 소방본부의 피난약자 구조ㆍ구급업무를 위한 도내 시ㆍ군 보유 장애인 개인정보 제공 요청에 관한 건,2020-07-13,5,#b45309,32.11543273925781,58.834754943847656,,목적 외 이용
data_provision_request,1245,농협경제지주의 축산관련 종사자 의무교육 실시를 위한 지방자치단체 보유 개인정보 제공 요청에 관한 건,2020-06-08,5,#b45309,29.742877960205078,70.31629943847656,,목적 외 이용
data_provision_request,1253,공정거래위원회의 자체감사를 위한 정부청사관리본부 보유 개인정보 제공 요청에 관한 건,2020-05-25,1,#059669,36.08040237426758,39.118141174316406,,목적 외 이용
data_provision_request,1255,지역발달장애인지원센터의 발달장애인 복지지원정보 안내를 위한 관내 시ㆍ군ㆍ구 보유 개인정보 제공 요청에 관한 건,2020-06-22,5,#b45309,35.81908416748047,64.98823547363281,,목적 외 이용
data_provision_request,129,"퇴직공제제도 고지업무를 위한 행정안전부, 대법원 보유 개인정보 제공 요청에 관한 건",2018-10-01,4,#0d9488,23.92220115661621,77.98403930664062,,목적 외 이용
data_provision_request,1303,한국도핑방지위원회의 스테로이드 구매 선수 제재를 위한 식품의약품안전처 보유 개인정보 제공 관련 변경 질의에 관한 건,2020-01-13,-1,#8a8a8a,25.00287628173828,88.5588607788086,,목적 외 이용
data_provision_request,1307,한국산업안전보건공단의 직업성 질환 역학조사를 위한 건설근로자공제회 보유 개인정보 제공 요청에 관한 건,2019-12-23,4,#0d9488,20.845430374145508,73.40650177001953,,목적 외 이용
data_provision_request,1311,서울특별시의 유급병가지원 사업 안내를 위한 국민건강보험공단 보유 개인정보 제공 요청에 관한 건,2019-10-28,5,#b45309,27.975223541259766,54.272254943847656,,목적 외 이용
data_provision_request,1313,경찰청의 과태료 체납액 징수를 위한 국민건강보험공단 보유 개인정보 제공에 관한 건,2020-02-24,1,#059669,14.782106399536133,52.100868225097656,,목적 외 이용
data_provision_request,1319,고용노동부의 구직급여 부정수급 반환조치를 위한 법무부 보유 개인정보 제공 요청에 관한 건,2019-12-23,4,#0d9488,13.65461540222168,84.74596405029297,,목적 외 이용
data_provision_request,1337,소방청의 119구급활동을 위한 의료기관 등 보유 개인정보 제공 요청에 관한 건,2020-03-23,5,#b45309,26.097623825073242,60.9239501953125,,목적 외 이용
data_provision_request,1339,인천광역시의 취약계층 연료비 지원사업을 위한 관내 구ㆍ군 보유 개인정보 제공 요청에 관한 건,2020-06-22,-1,#8a8a8a,45.29214096069336,53.283206939697266,,목적 외 이용
data_provision_request,1347,경기도의 소비자피해보상금 지급 안내를 위한 은행 등 보유 개인정보 제공 요청에 관한 건,2020-04-13,4,#0d9488,43.65131378173828,76.41637420654297,,목적 외 이용
data_provision_request,1349,천안시시설관리공단의 공원주차장 사용료 감면을 위한 차량등록사업소 보유 개인정보 제공 요청에 관한 건,2019-05-27,1,#059669,23.329730987548828,39.025489807128906,,목적 외 이용
data_provision_request,1365,교육청의 유치원 취학 수요조사를 위한 지방자치단체 보유 개인정보 제공 요청에 관한 건,2019-05-13,4,#0d9488,8.60772705078125,71.32662963867188,,목적 외 이용
data_provision_request,1383,주택용 소방시설 무상보급을 위한 개인정보 제공 요청에 관한 건,2019-07-08,5,#b45309,29.93789291381836,59.951576232910156,,목적 외 이용
data_provision_request,1397,서울보증보험㈜의 대출보증을 위한 국토교통부 보유 개인정보 제공에 관한 건,2019-06-10,1,#059669,20.583576202392578,34.121585845947266,,목적 외 이용
data_provision_request,1409,지역책임부대의 통합방위사태 대응 등을 위한 지방자치단체 보유 통합관제센터 영상정보 제공 요청에 관한 건,2019-07-22,-1,#8a8a8a,30.545604705810547,45.229148864746094,,영상정보 처리
data_provision_request,1419,울산광역시발달장애인지원센터의 발달장애인 복지지원정보 안내를 위한 울산시 관내 구ㆍ군 보유 개인정보 제공 요청에 관한 건,2019-09-23,5,#b45309,38.38906478881836,58.733673095703125,,목적 외 이용
data_provision_request,1421,경찰청의 운전면허 수시 적성검사를 위한 국민건강보험공단 보유 치매질환자 개인정보 제공에 관한 건,2019-10-28,1,#059669,14.563302040100098,47.11307144165039,,목적 외 이용
data_provision_request,1427,○○○항공의 항공기 관리업무를 위한 인천국제공항공사 보유 CCTV 영상정보 제공 요청에 관한 건,2019-10-14,1,#059669,31.590831756591797,35.197967529296875,,영상정보 처리
data_provision_request,1429,대구광역시 중구의회의 의정활동을 위한 대구광역시 중구 보유 개인정보 제공에 관한 건,2019-11-11,5,#b45309,42.49559020996094,61.755889892578125,,목적 외 이용
data_provision_request,1431,경기도의 소비자피해보상금 지급 안내를 위한 은행 등 보유 개인정보 제공 요청에 관한 건,2019-10-28,4,#0d9488,40.22781753540039,80.52605438232422,,목적 외 이용
data_provision_request,1437,공주시 보건소의 대상포진 예방접종 업무를 위한 공주시 보유 개인정보 제공 요청에 관한 건,2019-08-26,5,#b45309,22.435184478759766,60.73360061645508,,목적 외 이용
data_provision_request,1441,중앙행정기관의 제품 사고조사를 위한 한국소비자원 보유 개인정보 제공 요청에 관한 건,2019-02-11,5,#b45309,16.72179412841797,63.96244812011719,,목적 외 이용
data_provision_request,1449,공법보훈단체의 회원관리 등 업무를 위한 국가보훈처 보유개인정보 제공에 관한 건,2019-03-25,4,#0d9488,17.162776947021484,75.08773040771484,,목적 외 이용
data_provision_request,1467,수원시 도로교통관리사업소의 자동차 의무보험 가입촉구를 위한 보험개발원 보유 개인정보 제공에 관한 건,2022-04-27,3,#7c3aed,71.25790405273438,27.73255729675293,,목적 외 이용
data_provision_request,149,육군본부의 무공훈장 찾아주기 사업을 위한 국가보훈처 보유 개인정보 제공에 관한 건,2018-11-26,4,#0d9488,16.828033447265625,78.92523193359375,,목적 외 이용
data_provision_request,1529,여성가족부의 양육비 채무자 출국금지 요청 업무를 위한법무부 보유 개인정보 제공 요청에 관한 건,2022-06-08,0,#1e40af,92.6717300415039,23.813417434692383,,목적 외 이용
data_provision_request,153,경기도 연천군의 쓰레기 불법투기 단속을 위한 군부대 보유 개인정보 제공에관한 건,2018-11-26,-1,#8a8a8a,24.26903533935547,48.882728576660156,,영상정보 처리
data_provision_request,1537,국가보훈처의 국가유공자 등 약제비 지원을 위한국민건강보험공단 보유 개인정보 제공요청에 관한 건,2022-06-22,2,#dc2626,86.65736389160156,62.39629364013672,,목적 외 이용
data_provision_request,161,정부청사관리본부의 채권회수를 위한 세무서 보유 개인정보 제공에 관한 건,2018-12-10,4,#0d9488,6.156647682189941,68.7633056640625,,목적 외 이용
data_provision_request,1723,울산광역시의 승용차요일제 운휴일 준수여부 확인을 위한 울산시 구ㆍ군 보유 영상정보 제공 요청에 관한 건,2022-09-14,-1,#8a8a8a,43.557037353515625,15.352466583251953,,영상정보 처리
